Main Category,Category,Status,Product,Reason for Decision
Clean Eating,Coffee,Approved,"<a href=""https://biodynamiccoffee.com/"" target=""_blank"" rel=""noopener noreferrer"">Biodynamic Coffee</a>","Regeneratively grown, cleaner coffee option—great if you’re trying to minimize mold/mycotoxin risk and support soil health."
Clean Eating,Bread,Approved,"<a href=""https://www.veganbakerymiami.com/collections/einkorn-sourdough-bread"" target=""_blank"" rel=""noopener noreferrer"">Vegan Bakery - Ancient Grain Sourdough</a>","Minimal-ingredient sourdough (ancient grains) that’s traditionally fermented—gentler on digestion and aligned with clean eating."
Clean Eating,Yogurt,Approved,"<a href=""https://thecoconutcult.com/"" target=""_blank"" rel=""noopener noreferrer"">Coconut Cult</a>","Potent probiotic food—useful add-on if you’re rebuilding gut health."
Clean Eating,Dessert,Approved,"<a href=""https://www.veganbakerymiami.com/collections/vegan-cakes"" target=""_blank"" rel=""noopener noreferrer"">Ancient Grains Cake</a>","Vegan desserts made with Organic Kamut that’s stone ground daily for optimal nutritional content. Clean and minimal ingredients."
Clean Eating,Olive Oil,Approved,"<a href=""https://www.veganbakerymiami.com/collections/superfoods-soups/products/olive-oil-from-ancient-heirloom-trees"" target=""_blank"" rel=""noopener noreferrer"">Olive Oil</a>","Premium Olive Oil produced from Ancient Heirloom trees 300-1000 years old. These trees are strong and nutrient rich due to ancient farming techniques that safeguard the soil, producing high polyphenol olive oil."
Clean Eating,Snacks,Approved,"<a href=""https://www.veganbakerymiami.com/collections/superfoods-soups/products/olives-from-ancient-heirloom-trees-8-oz"" target=""_blank"" rel=""noopener noreferrer"">Black Olives</a>","High Antioxidant levels and Anti-Inflammatory properties. From Ancient Heirloom Trees, Non-GMO, No Pesticides or fertilizers."
Clean Eating,Fermented Foods,Approved,"<a href=""https://www.veganbakerymiami.com/collections/superfoods-soups/products/umeboshi-fermented-plums-food-probiotics"" target=""_blank"" rel=""noopener noreferrer"">Fermented Plums</a>","Umeboshi plums are fermented plums, rich in probiotics. Rejuvenates the gut, acts as an anti-bacterial, anti-candida, and anti-parasitic. It also combats eczema and psoriasis; fights fatigue and aids the liver.   "
Clean Eating,Drinks,Approved,"<a href=""https://harmlessharvest.com/products/organic-coconut-water?variant=42532018094315"" target=""_blank"" rel=""noopener noreferrer"">Harmless Harvest Coconut Water</a>","Organic, Raw / minimally processed – No heat pasteurization, Naturally pink = high polyphenols (antioxidants)."
Cleaning,All-Purpose,Approved,"<a href=""https://branchbasics.com/collections/laundry/products/the-concentrate?variant=35565293764772"" target=""_blank"" rel=""noopener noreferrer"">Branch Basics Concentrate</a>","One base concentrate replaces many cleaners—simple, low-tox system that reduces chemical load."
Cleaning,All-Purpose,Approved,"<a href=""https://branchbasics.com/collections/all/products/hand-soap?variant=44613797970084"" target=""_blank"" rel=""noopener noreferrer"">Branch Basics Hand Soap</a>","Plant-based, fragrance-free cleaning that avoids harsh solvents and endocrine-disrupting ingredients."
Cleaning,All-Purpose,Approved,"<a href=""https://branchbasics.com/products/oxygen-boost"" target=""_blank"" rel=""noopener noreferrer"">Branch Basics Oxygen Boost</a>","Non-chlorine oxygen booster for stains/whitening—powerful without the toxic fumes and residues."
Cleaning,Laundry,Approved,"<a href=""https://branchbasics.com/products/laundry-detergent"" target=""_blank"" rel=""noopener noreferrer"">Branch Basics Laundry Detergent</a>","Fragrance-free, low-tox detergent that helps reduce skin irritation and overall chemical exposure."
Cleaning,Laundry,Approved,"<a href=""https://branchbasics.com/collections/laundry/products/dryer-balls?variant=36353615364260"" target=""_blank"" rel=""noopener noreferrer"">Branch Basics Wool Dryer Balls</a>","Replaces synthetic dryer sheets, reduces static, and helps laundry dry faster—easy low-tox upgrade."
Cleaning,Dishwasher,Approved,"<a href=""https://branchbasics.com/products/dishwasher-tablets"" target=""_blank"" rel=""noopener noreferrer"">Branch Basics Dishwasher Tablets</a>","Gets dishes clean without the harsh fragrance/dyes common in conventional pods."
Clothing,General,Approved,"<a href=""https://www.pakaapparel.com/pages/our-story"" target=""_blank"" rel=""noopener noreferrer"">Paka Apparel</a>","Traceable alpaca fiber clothing and underwear. Fair Trade Certified. Comfy, sustainable, and rooted in Andean tradition."
Clothing,General,Approved,"<a href=""https://rawganique.com/"" target=""_blank"" rel=""noopener noreferrer"">Rawganique</a>","Organic cotton, linen, and hemp clothing."
Clothing,General,Approved,"<a href=""https://fahertybrand.com/pages/about"" target=""_blank"" rel=""noopener noreferrer"">Faherty</a>","Organic cotton, linen, hemp and other natural fibers for women and men. Beachy, breathable, and thoughtfully made."
Grounding,Mats,Approved,"<a href=""https://grooniearthing.com/products/grounding-mat-for-bed"" target=""_blank"" rel=""noopener noreferrer"">Grooni Grounding Mat for Bed</a>","Grounding sleep setup—many people notice calmer sleep and less morning stiffness."
Grounding,Mats,Approved,"<a href=""https://www.earthing.com/products/earthing-universal-mat-kit?srsltid=AfmBOor4AaL89-NEHTZH_6NIQoQFuexS2fBDvrJ9uRX-k8kzHwCcgDlH"" target=""_blank"" rel=""noopener noreferrer"">Earthing Universal Grounding Mat</a>","Versatile grounding mat for desk/home—low-effort daily grounding time."
Grounding,Office,Approved,"<a href=""https://www.gethealthyandgrounded.com/products/earthing-mouse-pad?_pos=1&_psq=mouse+pad&_ss=e&_v=1.0"" target=""_blank"" rel=""noopener noreferrer"">Earthing Mouse Pad</a>","Office-friendly grounding upgrade—lets you stay connected while working."
Grounding,Blankets,Approved,"<a href=""https://grooniearthing.com/products/grounding-blanket?_pos=1&_sid=831cb8eaa&_ss=r"" target=""_blank"" rel=""noopener noreferrer"">Grooni Grounding Throw Blanket</a>","Grounding comfort layer for the couch/bed—simple way to rack up grounding time."
Grounding,Sandals,Approved,"<a href=""https://www.earthrunners.com/?pb=0&srsltid=AfmBOopAywKIMHlGIEeW7PHZ2Zqi_d0eloro6Q_-voIXfZTOXnYsljkM"" target=""_blank"" rel=""noopener noreferrer"">Earth Runners Grounding Sandals</a>","Conductive sandals that let you ground outdoors while keeping a minimalist, durable design."
Grounding,Socks,Approved,"<a href=""https://www.gethealthyandgrounded.com/products/no-show-silver-conductive-earthing-socks?variant=39558498123967"" target=""_blank"" rel=""noopener noreferrer"">Grounding Socks</a>","Easy way to stay grounded at home when you don’t want to be barefoot."
Home Goods,Candles,Approved,"<a href=""https://primallypure.com/collections/home-candles"" target=""_blank"" rel=""noopener noreferrer"">Primally Pure Candles</a>","Clean-burning candle with simple ingredients and no synthetic fragrance—cozy without the chemical load."
Home Goods,Sleep,Approved,"<a href=""https://www.coyuchi.com/products/organic-relaxed-linen-sheet-set-slate-chambray?variant=50911873499428"" target=""_blank"" rel=""noopener noreferrer"">Coyuchi Linen Bedsheets</a>","Breathable, high-quality organic linen for cooler sleep and fewer textile chemicals—plus it feels luxurious."
Home Goods,Dining,Approved,"<a href=""https://www.coyuchi.com/search?q=napkins"" target=""_blank"" rel=""noopener noreferrer"">Coyuchi Napkins</a>","Organic, reusable dining linens that replace paper waste and avoid mystery dyes/fragrances."
Home Goods,Kitchen,Approved,"<a href=""https://www.coyuchi.com/search?q=kitchen%20towels"" target=""_blank"" rel=""noopener noreferrer"">Coyuchi Kitchen Towels</a>","Soft, durable organic towels made without harsh finishes—everyday swap that quietly reduces toxin load."
Home Goods,Kitchen,Approved,"<a href=""https://www.coyuchi.com/search?q=produce+bags"" target=""_blank"" rel=""noopener noreferrer"">Coyuchi Produce Bags</a>","Plastic-free produce storage that cuts down on microplastics and makes grocery routines cleaner."
Home Goods,Bath,Approved,"<a href=""https://www.coyuchi.com/products/air-weight-organic-towels-shadow?variant=50911901614372"" target=""_blank"" rel=""noopener noreferrer"">Coyuchi Bath Towels</a>","Loomed from long loops of pure organic cotton; Dry off quickly and efficiently."
Home Goods,Kitchen,Approved,"<a href=""https://www.earlywooddesigns.com/"" target=""_blank"" rel=""noopener noreferrer"">Earlywood</a>","Heirloom wooden utensils that are non-toxic, functional, and absolutely stunning."
Home Goods,Paper Products,Approved,"<a href=""https://plantpaper.us/pages/plant-paper"" target=""_blank"" rel=""noopener noreferrer"">PlantPaper Toilet Paper</a>","Tree-free, gentle paper designed to avoid harsh bleaching and unnecessary additives."
Home Goods,Paper Products,Approved,"<a href=""https://plantpaper.us/pages/tissues"" target=""_blank"" rel=""noopener noreferrer"">PlantPaper Facial Tissues</a>","Soft, minimalist tissues that skip the perfumes and extra chemicals common in conventional options."
Home Goods,Lighting,Approved,"<a href=""https://www.blockbluelight.com/collections/sleep-enhancing-lighting/products/full-spectrum-light-bulb"" target=""_blank"" rel=""noopener noreferrer"">Block Blue Light - Full Spectrum</a>","Full-spectrum lighting that supports a calmer nervous system and healthier circadian rhythm indoors."
Home Goods,Lighting,Approved,"<a href=""https://www.blockbluelight.com/collections/sleep-enhancing-lighting/products/blue-blocking-red-sleep-bulb"" target=""_blank"" rel=""noopener noreferrer"">Block Blue Light - Red Light</a>","Red light at night helps reduce blue-light disruption—great for wind-down and deeper sleep."
Home Goods,Lighting,Approved,"<a href=""https://www.blockbluelight.com/products/red-light-motion-night-light?_pos=2&_psq=night+light&_ss=e&_v=1.0"" target=""_blank"" rel=""noopener noreferrer"">Block Blue Light - Red Night Light</a>","Low, sleep-friendly lighting so you can move around at night without nuking melatonin."
Kitchen Appliances,Coffee Maker,Approved,"<a href=""https://ratiocoffee.com/products/ratio-eight"" target=""_blank"" rel=""noopener noreferrer"">Ratio Eight</a>","Plastic-free; Metal & Glass Water Pathway"
Kitchen Appliances,Coffee Maker,Rejected,SMEG Drip Coffee Maker,"Failed safety criteria (plastic contact with hot water)"
Kitchen Appliances,Rice Cooker,Approved,"<a href=""https://cuchenusamall.com/products/6-cup-ih-dual-pressure-rice-cooker-crh-twk0640wus-copy"" target=""_blank"" rel=""noopener noreferrer"">Cuchen IH Dual Pressure CRP-TWK0640WUS</a>","Stainless steel inner pot (PFAS-free)"
Kitchen Appliances,Rice Cooker,Rejected,Zojirushi Neuro Fuzzy,"Excellent performance but not non-toxic"
Oral Health,Floss,Approved,"<a href=""https://www.terraco.co"" target=""_blank"" rel=""noopener noreferrer"">Terra & Co Floss</a>","Clean oral care without synthetic fibers"
Oral Health,Toothpaste,Approved,"<a href=""https://risewell.com"" target=""_blank"" rel=""noopener noreferrer"">RiseWell Toothpaste</a>","Supports remineralization without harsh ingredients"
Oral Health,Toothpaste,Approved,"<a href=""https://yayzebra.com/products/the-toothpaste-mint?srsltid=AfmBOoo2lJ50fMag8IBz0Jlc9pTw2WqvfRhpewloORbXPG9tgsTG-PvF"" target=""_blank"" rel=""noopener noreferrer""> Yay Zebra Toothpaste</a>","Non-toxic, hydroxyapatite-free toothpaste formulated with xylitol and gentle mineral abrasives to support oral health and cavity prevention without synthetic foaming agents, fluoride, or undisclosed fragrance."
Oral Health,Toothbrush,Approved,"<a href=""https://yayzebra.com/products/the-toothbrush?variant=44876943294640"" target=""_blank"" rel=""noopener noreferrer"">Yay Zebra's Boar Bristle Toothbrush</a>","Handcrafted toothbrush made with ethically sourced boar bristles and a sustainably sourced handle, offering a fully plastic-free brushing option that naturally softens with use while avoiding synthetic nylon bristles and microplastic exposure."
Oral Health,Floss,Rejected,"<a href=""https://www.dentallace.com"" target=""_blank"" rel=""noopener noreferrer"">Dental Lace Synthetic Floss</a>","Contains synthetic plastic fibers (polyester)."
Oral Health,Oil Pulling,Approved,"<a href=""https://www.simplyo3.com/products/ozone-pulling-solution"" target=""_blank"" rel=""noopener noreferrer"">Ozone Oil Pulling</a>","Ozonated oil blend to support oral detox and gum health."
Pet Care,Raw Food,Approved,"<a href=""https://ocraw.com/product/rabbit-produce/"" target=""_blank"" rel=""noopener noreferrer"">OC Raw Rabbit & Produce (for Cats & Dogs)</a>","Base diet staple"
Pet Care,Raw Food,Approved,"<a href=""https://www.vitalessentials.com/products/freeze-dried-raw-rabbit-entree-mini-nibs-cat-food"" target=""_blank"" rel=""noopener noreferrer"">Vital Essentials Rabbit Crunchy Nibs (for Cats & Dogs)</a>","Single-protein, freeze-dried raw food—high-value and easy on sensitive tummies."
Pet Care,Treats,Approved,"<a href=""https://greenjuju.com/products/rabbit-trainers"" target=""_blank"" rel=""noopener noreferrer"">Green Juju Rabbit Trainers (for Cats & Dogs)</a>","High-value sensitive-tummy treat"
Pet Care,Hydration / Topper,Approved,"<a href=""https://smallbatchpets.com/bone-broth-frozen"" target=""_blank"" rel=""noopener noreferrer"">Smallbatch Pets Bone Broth (for Cats & Dogs)</a>","Meal topper for hydration and digestion"
Pet Care,Hydration / Topper,Approved,"<a href=""https://www.thebonesandco.com/goat-milk"" target=""_blank"" rel=""noopener noreferrer"">Bones & Co. Raw Goat Milk (for Cats & Dogs)</a>","Hydration booster / topper"
Pet Care,Toys,Approved,"<a href=""https://lemonandlavendermadison.com/collections/organic-and-natural-pet-products"" target=""_blank"" rel=""noopener noreferrer"">Lemon & Lavender Rabbit Fur Spinner Cat Toy</a>","Favorite enrichment toy"
Pet Care,Toys,Approved,"<a href=""https://shop.fromthefieldpet.com/product/bae-the-hemp-body-pillow-cat-toy"" target=""_blank"" rel=""noopener noreferrer"">Hemp Body Pillow Cat Toy</a>","A must have!  Promotes bunny kicking kill tactics"
Pet Care,Cat Bowls,Approved,"<a href=""https://basisproducts.com"" target=""_blank"" rel=""noopener noreferrer"">Basis Products Stainless Steel Cat Bowls</a>","Non-toxic, dishwasher-safe, durable"
Pet Care,Treats,Approved,"<a href=""https://www.wildmeadowfarms.com/collections/egg-puffs-for-cats/products/egg-puffs-for-cats-with-catnip"" target=""_blank"" rel=""noopener noreferrer"">Wild Meadow Farms Egg Puffs</a>","Simple, high-protein treat with minimal ingredients—great for a clean, crunchy reward."
Pet Care,Treats,Approved,"<a href=""https://www.vitalessentials.com/products/freeze-dried-raw-rabbit-bites-cat-treats"" target=""_blank"" rel=""noopener noreferrer"">Vital Essentials Rabbit Bites (for Cats & Dogs)</a>","Single-protein, freeze-dried raw treat—high-value and easy on sensitive tummies."
Pet Care,Treats,Approved,"<a href=""https://www.vitalessentials.com/products/freeze-dried-raw-turkey-giblets-dog-treats"" target=""_blank"" rel=""noopener noreferrer"">Vital Essentials Turkey Treats (for Cats & Dogs)</a>","Protein-packed, single-ingredient treat—clean option without fillers or flavorings."
Skin Care,Deodorant,Approved,"<a href=""https://primallypure.com/collections/deodorant"" target=""_blank"" rel=""noopener noreferrer"">Primally Pure Deodorant</a>","Aluminum-free deodorant with simple ingredients—effective support without endocrine-disrupting extras."
Skin Care,Body,Approved,"<a href=""https://primallypure.com/collections/body-wash"" target=""_blank"" rel=""noopener noreferrer"">Primally Pure Body Wash</a>","Ultra-pure, castile-style body wash made from saponified organic oils and essential oils only; exceptionally gentle and nourishing, though low-foam and best for sensitive or dry skin."
Skin Care,Body,Approved,"<a href=""https://naturalsloth.com/products/lavender-bergamot-body-wash?variant=45660473786521"" target=""_blank"" rel=""noopener noreferrer"">Natural Sloth Body Wash</a>","Exceptionally clean, soap-based body wash preserved with botanical ferments, offering richer slip and a creamier lather than traditional castile formulas without any synthetic surfactants or fragrance."
Skin Care,Body,Approved,"<a href=""https://underluna.com/products/body-cleanser"" target=""_blank"" rel=""noopener noreferrer"">Under Luna Body Wash</a>","Hybrid botanical body wash combining aloe-based soap and gentle plant surfactants for a satisfying natural lather while remaining fully fragrance-transparent, microbiome-friendly, and toxin-free."
Skin Care,Face,Approved,"<a href=""https://primallypure.com/collections/cleansers"" target=""_blank"" rel=""noopener noreferrer"">Primally Pure Face Cleanser</a>","Simple cleanser that respects the skin barrier—less irritation, fewer questionable additives."
Skin Care,Face,Approved,"<a href=""https://primallypure.com/collections/skin-specific-serums"" target=""_blank"" rel=""noopener noreferrer"">Primally Pure Face Serum</a>","Nutrient-rich, minimalist serum that supports glow without a long list of mystery chemicals."
Skin Care,Lips,Approved,"<a href=""https://primallypure.com/products/lip-balm?variant=3577777411"" target=""_blank"" rel=""noopener noreferrer"">Primally Pure Lip Balm</a>","Clean balm you can actually feel good about ingesting—no petroleum or artificial flavors."
Skin Care,Sun,Approved,"<a href=""https://primallypure.com/collections/sunscreen"" target=""_blank"" rel=""noopener noreferrer"">Primally Pure Sunscreen</a>","Mineral-based sun protection without the common chemical-filter concerns."
Skin Care,Outdoor,Approved,"<a href=""https://primallypure.com/products/nature-spray?_pos=1&_sid=e0ceaef46&_ss=r"" target=""_blank"" rel=""noopener noreferrer"">Primally Pure Bug Spray</a>","Plant-based bug defense that avoids conventional pesticide-heavy formulas."
Skin Care,Body,Approved,"<a href=""https://primallypure.com/collections/body-oils"" target=""_blank"" rel=""noopener noreferrer"">Primally Pure Body Oil</a>","High quality carrier oils infused with organic essential oils leave skin radiant without leaving behind any oily residue."
Hair Care,Body,Approved,"<a href=""https://underluna.com/collections/ul-hair-care"" target=""_blank"" rel=""noopener noreferrer"">Under Luna Shampoo & Conditioner</a>","Therapeutic, herbal hair care formulated with plant saponins, fermented preservation, and zero synthetic fragrance or polymers, prioritizing scalp health and biological compatibility over cosmetic shortcuts."



















